<?xml version="1.0" encoding="UTF-8" standalone="yes" ?>
<candies xmlns:xsi="http://www.w3.org/2001/XMLSchema-instance"
         xmlns="http://www.epam.training.by/classes"
         xsi:schemaLocation="Task4xsd.xsd">

    <candy id="c1000" type="chocolate">
        <name>Stolichnye</name>
        <energy>10</energy>
        <ingredients>
            <water>10</water>
            <sugar>45</sugar>
            <fructose>0</fructose>
            <vanilla>5</vanilla>
            <chocolatetype>dark</chocolatetype>
        </ingredients>
        <value>
            <proteins>4</proteins>
            <fats>0</fats>
            <carbohydrates>20</carbohydrates>
        </value>
        <production>Komunarka</production>
    </candy>

    <candy id="c1001" type="caramel">
        <name>Barbaris</name>
        <energy>10</energy>
        <ingredients>
            <water>10</water>
            <sugar>50</sugar>
            <fructose>0</fructose>
            <vanilla>0</vanilla>
        </ingredients>
        <value>
            <proteins>3</proteins>
            <fats>0</fats>
            <carbohydrates>15</carbohydrates>
        </value>
        <production>Spartak</production>
    </candy>

    <candy id="c1002" type="caramel">
        <name>Key</name>
        <energy>15</energy>
        <ingredients>
            <water>200</water>
            <sugar>0</sugar>
            <fructose>50</fructose>
            <vanilla>10</vanilla>
        </ingredients>
        <value>
            <proteins>10</proteins>
            <fats>10</fats>
            <carbohydrates>20</carbohydrates>
        </value>
        <production>Kommunarka</production>
    </candy>

    <candy id="c1003" type="chocolate" topping="coconut crisp">
        <name>Alyonka</name>
        <energy>40</energy>
        <ingredients>
            <water>40</water>
            <sugar>70</sugar>
            <fructose>0</fructose>
            <vanilla>5</vanilla>
            <chocolatetype>milk</chocolatetype>
        </ingredients>
        <value>
            <proteins>20</proteins>
            <fats>10</fats>
            <carbohydrates>40</carbohydrates>
        </value>
        <production>Spartak</production>
    </candy>

    <candy id="c1004" type="souffle">
        <name>Aeroflot</name>
        <energy>40</energy>
        <ingredients>
            <water>45</water>
            <sugar>80</sugar>
            <fructose>0</fructose>
            <vanilla>5</vanilla>
        </ingredients>
        <value>
            <proteins>20</proteins>
            <fats>5</fats>
            <carbohydrates>50</carbohydrates>
        </value>
        <production>Kommunarka</production>
    </candy>
</candies>
